[
  {
    "passage_id": "smt.9.1.a",
    "work": "SMT",
    "kuhn_volume": "XII",
    "kuhn_page_start": 168,
    "kuhn_line_start": 7,
    "kuhn_page_end": 178,
    "kuhn_line_end": 1,
    "tei_div_path": "urn:cts:greekLit:tlg0057.tlg075.1st1K-grc1:9.1",
    "greek": "ὥσπερ οὖν εἰς Κύπρον ἕνεκα τῶν ἐν αὐτῇ μετάλλων, εἴς τε τὴν κοίλην Συρίαν, μόριον οὖσαν τῆς Παλαιστίνης, ἕνεκεν ἀσφάλτου καί τινων ἄλλων κατ’ αὐτὴν ἀξίων ἱστορίας ἐπορεύθην, οὕτως καὶ εἰς Λῆμνον οὐκ ὤκνησα πλεῦσαι, θεασόμενος ὁπόσον μίγνυται τοῦ αἵματος τῇ γῇ. καὶ τό γε δεύτερον ἐξ Ἀσίας εἰς Ῥώμην ἀφικέσθαι πεζῇ πορευόμενος διὰ Θρᾴκης τε καὶ Μακεδονίας, ἔπλευσα πρότερον ἀπὸ Τρῳάδος Ἀλεξανδρείας εἰς Λῆμνον, ἐπιτυχὼν εἰς Θεσσαλονίκην ἀναγομένου πλοίου, συνθεμένῳ τῷ ναυκλήρῳ παραβάλλειν πρότερον τῇ Λήμνῳ· ὁ δὲ προσέσχε μὲν, οὐ μὴν ᾗ γ’ ἐχρῆν πόλει. τὴν ἀρχὴν γὰρ οὐδ’ ἠπιστάμην δύο πόλεις εἶναι κατὰ τὴν νῆσον, ἀλλὰ ᾤμην, ὡς Σάμον καὶ Χίον καὶ Κῶ Ἄνδρον τε καὶ Τῆνον καὶ πάσας τὰς κατὰ τὸ Αἰγαῖον, οὕτω καὶ τὴν Λῆμνον ὁμώνυμον ἔχειν πόλιν ὅλῃ τῇ νήσῳ μίαν. ὡς δὲ ἀποβὰς τῆς νεὼς, ἔγνων Μυρίναν μὲν ὀνομάζεσθαι τὴν πόλιν, εἶναι δ’ οὔτε κατὰ Φιλοκτήτην οὔτε κατὰ τὸ ἱερὸν τοῦ Ἡφαίστου λόφον ἐν τῇ χώρᾳ τῆς πόλεως ἐκείνης, ἀλλ’ ἐν ἑτέρᾳ τῇ Ἡφαιστιάδι καλουμένῃ, καὶ οὐδ’ ἐγγὺς εἶναι τὴν πόλιν ἐκείνην τῆς Μυρίνης, ὅ τε ναύκληρος οὐκ ἠδύνατό με περιμένειν, ἀνεβαλλόμην εἰσαῦθις, ὅταν ἀπὸ Ῥώμης εἰς Ἀσίαν ἀφίκωμαι, θεάσασθαι τὴν Ἡφαιστιάδα.",
    "translation_en": "For just as I traveled to Cyprus on account of its mines, and to Coele Syria — a part of Palestine — on account of asphalt and certain other things in it worth investigating, so too I did not hesitate to sail to Lemnos, in order to observe how much blood is mixed with the earth. And on the second occasion when I was making my way from Asia to Rome on foot through Thrace and Macedonia, I had earlier sailed from Alexandria Troas to Lemnos: I had caught a ship putting out for Thessalonica, having arranged with the captain that he should put in at Lemnos first. He did so — but not at the city he should have. For at first I did not even know that there were two cities on the island; rather, I assumed that — just as Samos and Chios and Cos and Andros and Tenos and all the islands of the Aegean each have a single city of the same name as the whole island — Lemnos likewise had a single city of the same name as the whole island. But when I disembarked from the ship, I learned that the city was called Myrina, and that the place [I needed] lay neither in Philoctetes' [country] nor near the sacred hill of Hephaestus within that city's territory, but in the other city — the one called Hephaistia — and that Hephaistia was not even close to Myrina; and since the captain could not wait for me, I deferred [the visit] to a later occasion, whenever I should come back from Rome to Asia, to see Hephaistia.",
    "route_keys": [
      "lemnos-alexandria-troas-to-thessalonica-context",
      "cyprus-soloi-mines",
      "coele-syria-dead-sea-materials"
    ],
    "place_mentions": [
      {
        "surface": "Κύπρον",
        "place_key": "cyprus_island",
        "evidence_category": "B"
      },
      {
        "surface": "κοίλην Συρίαν",
        "place_key": "coele_syria",
        "evidence_category": "A"
      },
      {
        "surface": "Παλαιστίνης",
        "place_key": "palestine",
        "evidence_category": "B"
      },
      {
        "surface": "Λῆμνον",
        "place_key": "lemnos",
        "evidence_category": "A"
      },
      {
        "surface": "Ἀσίας",
        "place_key": "asia_province",
        "evidence_category": "B"
      },
      {
        "surface": "Ῥώμην",
        "place_key": "rome",
        "evidence_category": "B"
      },
      {
        "surface": "Θρᾴκης",
        "place_key": "thracia_region",
        "evidence_category": "B"
      },
      {
        "surface": "Μακεδονίας",
        "place_key": "macedonia_region",
        "evidence_category": "B"
      },
      {
        "surface": "Τρῳάδος Ἀλεξανδρείας",
        "place_key": "alexandria_troas",
        "evidence_category": "A"
      },
      {
        "surface": "Θεσσαλονίκην",
        "place_key": "thessalonica",
        "evidence_category": "B"
      },
      {
        "surface": "Σάμον",
        "place_key": "samos",
        "evidence_category": "C"
      },
      {
        "surface": "Χίον",
        "place_key": "chios",
        "evidence_category": "C"
      },
      {
        "surface": "Αἰγαῖον",
        "place_key": "aegean_sea",
        "evidence_category": "C"
      },
      {
        "surface": "Μυρίναν",
        "place_key": "myrina_lemnos",
        "evidence_category": "B"
      },
      {
        "surface": "Μυρίνης",
        "place_key": "myrina_lemnos",
        "evidence_category": "B"
      },
      {
        "surface": "Ῥώμης",
        "place_key": "rome",
        "evidence_category": "B"
      },
      {
        "surface": "Ἀσίαν",
        "place_key": "asia_province",
        "evidence_category": "B"
      },
      {
        "surface": "Ἡφαιστιάδα",
        "place_key": "hephaistia",
        "evidence_category": "A"
      }
    ],
    "materia_mentions": [
      {
        "surface": "ἀσφάλτου",
        "materia_key": "asphalt"
      },
      {
        "surface": "αἵματος τῇ γῇ",
        "materia_key": "lemnian-earth"
      }
    ],
    "is_route_anchor": true
  },
  {
    "passage_id": "smt.9.1.b",
    "work": "SMT",
    "kuhn_volume": "XII",
    "kuhn_page_start": 168,
    "kuhn_line_start": 7,
    "kuhn_page_end": 178,
    "kuhn_line_end": 1,
    "tei_div_path": "urn:cts:greekLit:tlg0057.tlg075.1st1K-grc1:9.1",
    "greek": "ὡς γὰρ ἀπὸ τῆς Ἰταλίας διαβαλὼν εἰς τὴν Μακεδονίαν καὶ σχεδὸν ὅλην αὐτὴν ὁδοιπορήσας ἐν Φιλίπποις ἐγενόμην, ἥπερ ἐστὶν ὅμορος τῇ Θρᾴκῃ πόλις, ἐντεῦθεν ἐπὶ τὴν πλησίον θάλατταν εἴκοσιν ἐπὶ τοῖς ἑκατὸν ἀπέχουσαν στάδια κατελθὼν, ἔπλευσα πρότερον μὲν εἰς Θάσον ἐγγύς που διακοσίους σταδίους, ἐκεῖθεν δὲ εἰς Λῆμνον ἑπτακοσίους, εἶτ’ αὖθις ἀπὸ Λήμνου τοὺς ἴσους ἑπτακοσίους εἰς Ἀλεξανδρείαν Τρῳάδα. καὶ διὰ τοῦτ’ ἐξεπίτηδες ἔγραψα περί τε τοῦ πλοῦ καὶ τῶν σταδίων, ὅπως εἴ τις ἐθέλῃ θεάσασθαι καὶ αὐτὸς ὁμοίως ἐμοὶ τὴν Ἡφαιστιάδα διαγινώσκων τὴν θέσιν αὐτῆς, οὕτως παρασκευάζοιτο πρὸς τὸν πλοῦν. ἐν γάρ τοι τῇ ὅλῃ νήσῳ τῇ Λήμνῳ, κατὰ μὲν τὸ πρὸς ταῖς ἀνατολαῖς μέρος αὐτῆς ἐστιν Ἡφαιστιὰς, κατὰ δὲ τὸ πρὸς ταῖς δυσμαῖς ἡ Μυρίνα.",
    "translation_en": "For when I had crossed from Italy into Macedonia, traveled through nearly the whole of it, and arrived at Philippi — a city bordering Thrace — I went down from there to the nearby coast (a hundred and twenty stades distant) and sailed first to Thasos, about two hundred stades, then from there to Lemnos, seven hundred more, then again from Lemnos the same seven hundred to Alexandria Troas. It is precisely for this reason that I have written explicitly about the voyage and the distances: so that anyone wishing, as I did, to inspect Hephaistia and ascertain its position may equip himself for the voyage accordingly.",
    "route_keys": [
      "lemnos-italy-to-troas-via-thasos"
    ],
    "place_mentions": [
      {
        "surface": "Ἰταλίας",
        "place_key": "italia_peninsula",
        "evidence_category": "B"
      },
      {
        "surface": "Μακεδονίαν",
        "place_key": "macedonia_region",
        "evidence_category": "B"
      },
      {
        "surface": "Φιλίπποις",
        "place_key": "philippi",
        "evidence_category": "A"
      },
      {
        "surface": "Θρᾴκῃ",
        "place_key": "thracia_region",
        "evidence_category": "B"
      },
      {
        "surface": "τὴν πλησίον θάλατταν",
        "place_key": "philippi_nearby_coast",
        "evidence_category": "B"
      },
      {
        "surface": "Θάσον",
        "place_key": "thasos",
        "evidence_category": "A"
      },
      {
        "surface": "Λῆμνον",
        "place_key": "lemnos",
        "evidence_category": "A"
      },
      {
        "surface": "Ἀλεξανδρείαν Τρῳάδα",
        "place_key": "alexandria_troas",
        "evidence_category": "A"
      },
      {
        "surface": "Ἡφαιστιάδα",
        "place_key": "hephaistia",
        "evidence_category": "A"
      },
      {
        "surface": "Λήμνῳ",
        "place_key": "lemnos",
        "evidence_category": "A"
      },
      {
        "surface": "Ἡφαιστιὰς",
        "place_key": "hephaistia",
        "evidence_category": "A"
      },
      {
        "surface": "Μυρίνα",
        "place_key": "myrina_lemnos",
        "evidence_category": "B"
      }
    ],
    "materia_mentions": [
      {
        "surface": "Ἡφαιστιάδα",
        "materia_key": "lemnian-earth"
      }
    ],
    "is_route_anchor": true
  },
  {
    "passage_id": "smt.9.2.a",
    "work": "SMT",
    "kuhn_volume": "XII",
    "kuhn_page_start": 203,
    "kuhn_line_start": 0,
    "kuhn_page_end": 204,
    "kuhn_line_end": 2,
    "tei_div_path": "urn:cts:greekLit:tlg0057.tlg075.1st1K-grc1:9.2",
    "greek": "οὐ μὴν ἐγὼ εἶδον ἐκεῖνον τὸν ποταμὸν, καίτοι παραπλεύσας ὅλην Λυκίαν μικρῷ πλοίῳ τῆς ἱστορίας ἕνεκα τῶν ἐν αὐτῇ. πλακώδεις δὲ λίθους μελαίνας, εἰ κατὰ πυρὸς ἐπιτεθεῖεν, ἀσθενῆ φλόγα γεννῶντας ἐκόμισα πολλὰς ἐκ τῆς κοίλης Συρίας, ἐν τῷ λόφῳ γεννωμένας τῷ περιέχοντι τὴν νεκρὰν ὀνομαζομένην θάλασσαν, ἐν τοῖς ἀνατολικοῖς αὐτῆς μέρεσιν, ἔνθα καὶ ἡ ἄσφαλτος γίνεται. καὶ ἦν ἡ ὀσμὴ τῶν λίθων τῇ ἀσφάλτῳ παραπλησία.",
    "translation_en": "I myself did not see that river, although I sailed past the whole of Lycia in a small boat for the sake of investigating the things in it. But I did bring back many flat black stones — which, if laid on a fire, produce a feeble flame — from Coele Syria, generated in the hill that surrounds the so-called Dead Sea, in its eastern parts, where the asphalt is also produced. And the smell of the stones was very like that of the asphalt.",
    "route_keys": [
      "coele-syria-dead-sea-materials"
    ],
    "place_mentions": [
      {
        "surface": "Λυκίαν",
        "place_key": "lycia",